{
  "manifest_version": 1,
  "operation_result_schema": "adapter-conformance-operation-result-v1.schema.json",
  "stable_error_categories": [
    "validation_error",
    "asset_load_or_decode_error",
    "stale_or_incompatible_asset_error",
    "schema_mismatch_error",
    "no_active_session_error",
    "session_already_active_error",
    "unknown_start_block_error",
    "invalid_choice_error",
    "unavailable_choice_error",
    "stale_choice_error",
    "missing_condition_handler_error",
    "condition_evaluation_error",
    "invalid_condition_result_error",
    "effect_acknowledgement_error",
    "rejected_changed_asset_refresh_error",
    "save_load_incompatibility_error",
    "localisation_error",
    "missing_projection_handler_error",
    "projection_evaluation_error",
    "invalid_projection_result_error"
  ],
  "reference_driver": {
    "changed_asset_policy": "reject_refresh_until_session_ends",
    "capabilities": [
      "source_import_visibility",
      "schema_import_visibility"
    ]
  },
  "scenarios": [
    {
      "id": "validation_error_invalid_source_fixture",
      "title": "Invalid source fixture maps to validation_error",
      "requirement_level": "mandatory",
      "execution_mode": "reference_driver",
      "capability_gates": [],
      "expected_error": {
        "error_category": "validation_error"
      },
      "steps": [
        {
          "operation": {
            "kind": "compile_invalid_fixture",
            "fixture": "fixtures/recite/invalid/compiler_validation_order.recite"
          },
          "expect": {
            "status": "error",
            "error_category": "validation_error"
          }
        }
      ]
    },
    {
      "id": "asset_load_or_decode_error_truncated_messagepack",
      "title": "Malformed compiled bytes map to asset_load_or_decode_error",
      "requirement_level": "mandatory",
      "execution_mode": "reference_driver",
      "capability_gates": [],
      "expected_error": {
        "error_category": "asset_load_or_decode_error"
      },
      "steps": [
        {
          "operation": {
            "kind": "decode_compiled_bytes",
            "bytes_case": "truncated_messagepack"
          },
          "expect": {
            "status": "error",
            "error_category": "asset_load_or_decode_error"
          }
        }
      ]
    },
    {
      "id": "stale_or_incompatible_asset_error_asset_mismatch_on_advance",
      "title": "Advancing with a mismatched compiled asset maps to stale_or_incompatible_asset_error",
      "requirement_level": "mandatory",
      "execution_mode": "reference_driver",
      "capability_gates": [],
      "expected_error": {
        "error_category": "stale_or_incompatible_asset_error"
      },
      "steps": [
        {
          "operation": {
            "kind": "compile_fixture",
            "fixture": "fixtures/recite/valid/adapter_conformance/runtime_surface.recite",
            "asset_slot": "primary",
            "asset_id": "dialogue/runtime_surface_primary.recitec"
          },
          "expect": {
            "status": "ok"
          }
        },
        {
          "operation": {
            "kind": "compile_fixture",
            "fixture": "fixtures/recite/valid/adapter_conformance/runtime_surface.recite",
            "asset_slot": "alternate",
            "asset_id": "dialogue/runtime_surface_alternate.recitec"
          },
          "expect": {
            "status": "ok"
          }
        },
        {
          "operation": {
            "kind": "import_asset",
            "asset_slot": "primary"
          },
          "expect": {
            "status": "ok"
          }
        },
        {
          "operation": {
            "kind": "import_asset",
            "asset_slot": "alternate"
          },
          "expect": {
            "status": "ok"
          }
        },
        {
          "operation": {
            "kind": "start_session",
            "asset_slot": "primary"
          },
          "expect": {
            "status": "ok"
          }
        },
        {
          "operation": {
            "kind": "advance",
            "asset_slot": "alternate"
          },
          "expect": {
            "status": "error",
            "error_category": "stale_or_incompatible_asset_error"
          }
        }
      ]
    },
    {
      "id": "schema_mismatch_error_on_restore",
      "title": "Restoring against a schema-mismatched compiled asset maps to schema_mismatch_error",
      "requirement_level": "mandatory",
      "execution_mode": "reference_driver",
      "capability_gates": [],
      "expected_error": {
        "error_category": "schema_mismatch_error"
      },
      "steps": [
        {
          "operation": {
            "kind": "compile_fixture",
            "fixture": "fixtures/recite/valid/adapter_conformance/runtime_surface.recite",
            "asset_slot": "schema_a",
            "schema_fingerprint": "schema:a"
          },
          "expect": {
            "status": "ok"
          }
        },
        {
          "operation": {
            "kind": "compile_fixture",
            "fixture": "fixtures/recite/valid/adapter_conformance/runtime_surface.recite",
            "asset_slot": "schema_b",
            "schema_fingerprint": "schema:b"
          },
          "expect": {
            "status": "ok"
          }
        },
        {
          "operation": {
            "kind": "import_asset",
            "asset_slot": "schema_a"
          },
          "expect": {
            "status": "ok"
          }
        },
        {
          "operation": {
            "kind": "start_session",
            "asset_slot": "schema_a"
          },
          "expect": {
            "status": "ok"
          }
        },
        {
          "operation": {
            "kind": "save_session",
            "snapshot_slot": "schema_snapshot"
          },
          "expect": {
            "status": "ok"
          }
        },
        {
          "operation": {
            "kind": "end_session"
          },
          "expect": {
            "status": "ok"
          }
        },
        {
          "operation": {
            "kind": "import_asset",
            "asset_slot": "schema_b"
          },
          "expect": {
            "status": "ok"
          }
        },
        {
          "operation": {
            "kind": "load_session",
            "snapshot_slot": "schema_snapshot",
            "asset_slot": "schema_b"
          },
          "expect": {
            "status": "error",
            "error_category": "schema_mismatch_error"
          }
        }
      ]
    },
    {
      "id": "no_active_session_error_after_explicit_end",
      "title": "Operations after explicit end_session map to no_active_session_error",
      "requirement_level": "mandatory",
      "execution_mode": "reference_driver",
      "capability_gates": [],
      "expected_error": {
        "error_category": "no_active_session_error"
      },
      "steps": [
        {
          "operation": {
            "kind": "compile_fixture",
            "fixture": "fixtures/recite/valid/adapter_conformance/runtime_surface.recite",
            "asset_slot": "main"
          },
          "expect": {
            "status": "ok"
          }
        },
        {
          "operation": {
            "kind": "import_asset",
            "asset_slot": "main"
          },
          "expect": {
            "status": "ok"
          }
        },
        {
          "operation": {
            "kind": "set_condition_behavior",
            "function": "trusts",
            "behavior_kind": "bool",
            "bool_value": false
          },
          "expect": {
            "status": "ok"
          }
        },
        {
          "operation": {
            "kind": "start_session",
            "asset_slot": "main"
          },
          "expect": {
            "status": "ok"
          }
        },
        {
          "operation": {
            "kind": "advance"
          },
          "expect": {
            "status": "ok",
            "event_kind": "line",
            "line_text": "Intro line."
          }
        },
        {
          "operation": {
            "kind": "advance"
          },
          "expect": {
            "status": "ok",
            "event_kind": "effect",
            "effect_function": "intro_sfx",
            "effect_mode": "immediate"
          }
        },
        {
          "operation": {
            "kind": "advance"
          },
          "expect": {
            "status": "ok",
            "event_kind": "prompt",
            "prompt_choice_ids": [
              "3f481d9991fa22e23b0c",
              "8706986735003ec9aaec"
            ],
            "prompt_unavailable_choice_ids": [
              "8706986735003ec9aaec"
            ]
          }
        },
        {
          "operation": {
            "kind": "choose",
            "choice_id": "3f481d9991fa22e23b0c"
          },
          "expect": {
            "status": "ok",
            "event_kind": "effect",
            "effect_function": "grant_item",
            "effect_mode": "blocking"
          }
        },
        {
          "operation": {
            "kind": "remember_pending_effect_id",
            "slot": "blocking_effect"
          },
          "expect": {
            "status": "ok"
          }
        },
        {
          "operation": {
            "kind": "acknowledge_effect",
            "ack": "completed",
            "effect_slot": "blocking_effect"
          },
          "expect": {
            "status": "ok"
          }
        },
        {
          "operation": {
            "kind": "advance"
          },
          "expect": {
            "status": "ok",
            "event_kind": "prompt",
            "prompt_choice_ids": [
              "ced14b8623bba2198c6d"
            ]
          }
        },
        {
          "operation": {
            "kind": "choose",
            "choice_id": "ced14b8623bba2198c6d"
          },